id,first_name,last_name,specialty,linkedin,company,region,new_region,local_region,image,summary
131,Lydianne,Yap,Fashion & Luxury,https://www.linkedin.com/in/lydianne-yap-58602069/,Digital Luxury Group (DLG),Greater China,Greater China,,https://media-exp1.licdn.com/dms/image/C5603AQHKDV3vUmax4w/profile-displayphoto-shrink_200_200/0?e=1589414400&v=beta&t=6XuQUpwG7QMZj7Blmnt2RjWPayiEmwj025qeSGqD9Rg,"Previously a lifestyle journalist with strong experience in the luxury sector, I now craft content – ranging from CEO interviews and industry features to data-driven trend reports – for luxury executives. I also run the Luxury Society Keynote, an exclusive annual conference for luxury professionals that features speakers from top luxury brands and tech giants the likes of Tencent, Alibaba, Baidu and Sina Weibo."
132,Iris,Chan,Fashion & Luxury,https://www.linkedin.com/in/iriscwchan/,Digital Luxury Group (DLG),USA,North America,,https://media-exp1.licdn.com/dms/image/C4D03AQH0S2_8MEO_QQ/profile-displayphoto-shrink_200_200/0?e=1589414400&v=beta&t=Wx2VuBib9jUU5AMZDkeEWv9o92BQCIJXgLn30OTaUEE,"Over 10 years of agency and consulting experience in North American and Asia Pacific markets, specializing in the luxury category and working closely with brands like Four Seasons Hotels, LVMH, Richemont, Swatch Group, Ermenegildo Zegna, Christian Louboutin, Estée Lauder Companies, Ralph Lauren and many more. Experience spans the areas of branding and communication strategy, digital strategy, market research and analysis, media and editorial planning, and marketing activations online and offline."
133,Jennifer,Spark,Fashion & Luxury,https://www.linkedin.com/in/jennifer-spark-1abb436/,The Luxury Network Australia,Australia,Australia & New Zealand,,https://media-exp1.licdn.com/dms/image/C4E03AQF3jIufevjWfg/profile-displayphoto-shrink_200_200/0?e=1589414400&v=beta&t=EBSxPQM4witxy1bQJgJTuNdfuyNQHlWsyKQ6v1lopl8,"For over 20 years my passion has been to understand the core values, drivers, cultural complexities and language of China, and to share what I have learned about this fascinating country with individuals and organisations and create tools to communicate their brands, business services and company values in an effective and authentic way."
134,Johanna,Atterby,Tourism & Hospitality,https://www.linkedin.com/in/johannaatterby/,Visit Stockholm,Sweden,Europe,,https://media-exp1.licdn.com/dms/image/C4D03AQGhUTRO9pCnDA/profile-displayphoto-shrink_200_200/0?e=1589414400&v=beta&t=-GqIObYRDS14tAxuHKtm8lRvy9vFDwgsj_q2RfsAhLo,Experienced marketing specialist with a focus on the Greater China area. Master degree in business and economics as well as a Bachelor of arts in Chinese from Uppsala University.
135,Anne,Ye,Tourism & Hospitality,https://www.linkedin.com/in/anna-ye-504a72100/,Value China,Italy,Europe,,https://media-exp1.licdn.com/dms/image/C5103AQHNulkY0Bd9rg/profile-displayphoto-shrink_200_200/0?e=1589414400&v=beta&t=G6uq2tS4ja5IHw8GE5aQ3PxEa4dUppnzmyK5vWTVzyU,
136,Suzanne,Loo,,https://www.linkedin.com/in/suzanneloo/,TechNode,Greater China,Greater China,,https://media-exp1.licdn.com/dms/image/C5103AQFIWCSqctPF0w/profile-displayphoto-shrink_200_200/0?e=1589414400&v=beta&t=BQ1QE9AdpbSxO5jQXPFCAOj8wmTfrsqBSbAh54B2Dbc," I specialize in local and international students recruitment, cross-cultural events, marketing and communications for international schools in China. Fascinated by the technological advancement in China, I am honored to be a part of a community that brings like-minded people from various backgrounds and expertise to share inspiring stories in tech. Feel free to contact me at suzanne.loo@technode.com if you have any business-related ideas or a keen interest in being a part of our TechNode community. "
137,Ada,Wang,,https://www.linkedin.com/in/ada-wang-495a7322/,Sinorbis,Australia,Australia & New Zealand,,,"Having worked and lived in both China and Australia, Ada has over 10 years’ experiences in international trade between the two countries, with a solid area of expertise in cross–border E-Commerce."
138,Dandan,Cheng,Ecommerce,https://www.linkedin.com/in/dandan-cheng-9bb452/,Sinorbis,Greater China,Greater China,,https://media-exp1.licdn.com/dms/image/C4D03AQHlTlQYShqjng/profile-displayphoto-shrink_200_200/0?e=1589414400&v=beta&t=vl_g-tO7OlRr06IikRCvQsm5YU7ijkpPn578q3QbCDE,"As the COO and one of the co-founders of Sinorbis, Dandan is responsible for business operations and customer success. She is a cross-border leader with deep expertise in Chinese market entry strategies and business operations."
139,Harmeet,Kaur,Branding,https://www.linkedin.com/in/harmeet-k-489b6812,ALTERNATIVE brands,Greater China,Greater China,,https://media-exp1.licdn.com/dms/image/C5103AQE5bwX_u42Fog/profile-displayphoto-shrink_200_200/0?e=1590019200&v=beta&t=U2DADjOaFgNM-M0NdND0gwWSpzifyaFbO4903QpgEeo,"Brand marketer for last 12+ years (ex-Unilever, ex-LOreal), turned entrepreneur who focuses on re-building brands in this age of internet, screens and all things digital. Lover & propagator of human-led strategic thinking."
140,Marlene,Chang,B2B,https://www.linkedin.com/in/marlene-chang-16b49815/,Self Employed,Greater China,Greater China,,https://media-exp1.licdn.com/dms/image/C5103AQGyUHRb_pz9Yw/profile-displayphoto-shrink_200_200/0?e=1590019200&v=beta&t=gbG0-noLRkzlyXur82yoO__rtNhIkELtdYfuyN7co1U,"Senior executive with 20+ years’ experience in Business strategy, Product life-cycle
Management (new launch and re-stage), Omni-channel integrated Marketing and
Communication, Brand building, and Digital/E-commerce operation."
141,Alva,Lv,Branding,https://www.linkedin.com/in/alva-lvchao/,Labbrand,Greater China,Greater China,,https://media-exp1.licdn.com/dms/image/C5103AQE3753Lcn7gew/profile-displayphoto-shrink_200_200/0?e=1590019200&v=beta&t=jIejcG6DICldgvclK7brg5WNaOQmD3xV0zEpT-NV31I,"Experienced consultant in creating impactful verbal identities for all walks of industry. Skilled in brand innovation, client communication, trademark system. Passionate about being the guiding partner along your branding journey."
142,Violet,Shen,PR,https://www.linkedin.com/in/violet-shen-86b6a843/,VJ International,Greater China,Greater China,,https://media-exp1.licdn.com/dms/image/C5603AQH7tJ49tcoAVw/profile-displayphoto-shrink_200_200/0?e=1590019200&v=beta&t=dEpRR341jBMa2J6VsAtDlNcTki95zdAmVw8doCZ6Gzs,"Based in Shanghai, Violet Shen has more than 15 years solid experience in branding consulting, PR, events, marketing and journalism in Greater China.Violet set up her own branding consulting company VJ international starting from 2014."
143,Carol,Wong,B2B,https://www.linkedin.com/in/caroltwwong/,OEP Asia,Greater China,Greater China,,https://media-exp1.licdn.com/dms/image/C5103AQFrJ3l6QEEhoA/profile-displayphoto-shrink_200_200/0?e=1590019200&v=beta&t=BlO4LwVYao7yXv5rDfMndeKpAlxo8OsRjdLgFF7XiaI,Supporting schools in Asia to grow and thrive | marketing | admissions
144,Ariel,Tsai,Social Media,https://www.linkedin.com/in/ariel-yi-chen-tsai-037922146/,PingPong Digital,United Kingdom,Europe,,https://media-exp1.licdn.com/dms/image/C5603AQFc30BeSV3Yaw/profile-displayphoto-shrink_200_200/0?e=1591228800&v=beta&t=Svh493MVjLwsG-uinf2lQzHskmKnICU14r3fH2qMd1I,"Business Development Manager at PingPong Digital. We are a Chinese digital marketing agency and the official partner agency for Weibo, WeChat, Douyin and TouTiao. We have worked with more than 100 clients around the world."