id,first_name,last_name,specialty,linkedin,company,region,new_region,local_region,image,summary
92,Jenny ,Chan,,https://www.linkedin.com/in/jennychan/,WARC,Greater China,Greater China,,https://media-exp1.licdn.com/dms/image/C5103AQG9hbtK7Y-gxQ/profile-displayphoto-shrink_200_200/0?e=1589414400&v=beta&t=kX2V7Jmq7lFesevXCB2Isrb38TMNnG5NboVQNxOKiAo,"Jenny Chan is a trilingual journalist, focusing on Greater China, with 10 years of business journalism experience in fields as diverse as finance and creativity. Her current reporting dives much deeper than mainstream media into important subjects that matter to CMOs and the marketing elite, and explains the fastest-growing and most exciting market—China—to the English-speaking world. Understanding the ins and outs of the agency supply chain as well as how Chinese consumers are spending their money has helped her break stories such as: what was behind the scenes of the Dolce and Gabbana China fiasco, the first time the World Cup has more Chinese brand sponsors than ever, how a French agency’s corruption scandal unfolded in Shanghai, and when US brand Garnier exited the Chinese market, all ahead of international newswires. She has been invited to share her insights, moderate fireside chats, and chair panel discussions at events with themes as diverse as technology and public relations, including RISE, PRNewswire, China Connect, ROI Festival, Digital360 Conference, Brand China Summit, Asia’s Top 1000 Brands Briefing, Digital Media Works, Founder Institute, and so on. She writes, translates, shoots, and edits her own work; those abilities make her versatile filing stories in text, video, voice or infographics. "
93,Denise,Ng,,https://www.linkedin.com/in/missdng/,PHD China,Greater China,Greater China,,https://media-exp1.licdn.com/dms/image/C4E03AQEQXs1lO7J7AQ/profile-displayphoto-shrink_200_200/0?e=1589414400&v=beta&t=ki4Go-Wa0hNiigZaBD4PMRXge1uCKW1dSyGiGygyg2A,"Director of Partnerships at PHD China. From an executive assistant to a business director in mobile marketing; to building media relationships and launching brand campaigns with start ups, agencies and media partners; to learning, understanding and challenging, what works, what does not, and why."
94,Sophie,Coulon,Social Media,https://www.linkedin.com/in/sophiecoulon/,Mediasia,Greater China,Greater China,,https://media-exp1.licdn.com/dms/image/C5603AQEGIWpM5bxxcw/profile-displayphoto-shrink_200_200/0?e=1589414400&v=beta&t=oW6b3xiDl5X1OI2SuqxthjvqnS2p-TXWrO_UN9Hazy4,"Mediasia is a tech & digital agency based in Shanghai and specialized in Social Media, KOL strategies and the creation of digital experiences (websites, apps, mini games...)."
95,Heather Yixuan,Li,PR,https://www.linkedin.com/in/theDotConnector/,Self Employed,Greater China,Greater China,,https://media-exp1.licdn.com/dms/image/C5103AQH2XBIHObKlFA/profile-displayphoto-shrink_200_200/0?e=1589414400&v=beta&t=Fxmf4AbQI5cBVppOY6_-iW4J9nJd7K9nv_U5K48RDkI,"A tech-savvy, energetic and adventurous freelance consultant in collaboration with top China-focused startups & SMEs across various industries, with a focus on China-Africa relations and technology. Specialization: PR + Marketing, Social Media Strategy (Wechat, Facebook, Twitter & Instagram), Bilingual Copywriting(Translation), Account Management, Events, Business Development; General business services inquiries (visa, business registration, accounting, online shops etc.)"
96,Christie,Zhang,,https://www.linkedin.com/in/cristiez/,RÉSO Communications,Greater China,Greater China,,,"Founder and CEO of RÉSO Communications. Bridging global entrepreneurs with China ecosystem. Assisting brands from the inside by building a customized blueprint for future success, not only from high-level feature stories in influential media, but also through innovative programs, partnerships and events that drive conversation online to reach the right audience."
97,Jacquelien Postigo,Brussee,Branding,https://www.linkedin.com/in/jbrussee/,Labbrand,Greater China,Greater China,,https://media-exp1.licdn.com/dms/image/C5103AQGHdy4njKuBbg/profile-displayphoto-shrink_200_200/0?e=1589414400&v=beta&t=qB0gKHQYdgOUjShAVeI8qIn6rYADd12Nl0-gZwDfAA8,"A seasoned executive with over 12 years of experience including Strategy, Branding, Marketing, and Sales development in both B2B and B2C organisations across Europe, Middle East and Asia. The last 9 years I have spent in the midst of China’s rapid development towards becoming a main global hub of innovations. Currently interested in and inspired by how emerging technologies, like #AI and #blockchain, fuel the blurring of the real and the technological world. Impacting all disciplines, economies and industries, I am keen to understand how these technologies specifically have an impact on brands, their brand equity and on the branding practice as a whole. Contact me on LinkedIn, or via WeChat: JacquelienB or email: Jacquelien.Brussee@outlook.com "
98,Catherine,Hanson,Social Media,https://www.linkedin.com/in/catherine-hanson-china/,Röhlig Logistics,Greater China,Greater China,,https://media-exp1.licdn.com/dms/image/C5103AQG7lBlhn2IMdA/profile-displayphoto-shrink_200_200/0?e=1589414400&v=beta&t=5oHha8ZMYtc7AHJIwrZX0SuXeTsyM3wcSw3ENQ0GBnE,"Digital Content Manager and Chinese studies graduate. Demonstrated experience in web content, SEO optimization, branding, digital and social media marketing, with experience in the international travel and logistics industries.
"
99,Shirley ,Bai,,https://www.linkedin.com/in/shirley-b-440a7379/,Anytime Fitness,Greater China,Greater China,,https://media-exp1.licdn.com/dms/image/C5103AQEw3cLkTjcs9w/profile-displayphoto-shrink_200_200/0?e=1589414400&v=beta&t=CBB6CKsum_Mb90wnk8I3dDlYUC7f_RlPs4_WA87lWQ0,"Specialized in Brand management & marketing Strategy | PR & Communication | Digital & Events | Localization& Business Development with years of experience providing thorough and skillful strategies in fashion, beauty care , fitness, Health and sports industries. Helped startups to connect young entrepreneurs and investors in localizing and targeting the market.Participated in organizing “Global Forum 2014”, “2015 Shanghai Fashion Week” &“Milan Fashion Week” “Miss Universe China 2016 Training”, “ILTM Asia 2018 outbound luxury Travel &Hospitality fair” , etc. international events. Organized a multitude of nation-wide campaigns& PR activities independently, among included TED, LeanIn, Wine Australia, etc. many cross-border cooperation."
100,Belle,Yin,,https://www.linkedin.com/in/belle-yinyan/,3 Chairs Consulting,Switzerland,Europe,,https://media-exp1.licdn.com/dms/image/C4D03AQEi83iwn0LMBQ/profile-displayphoto-shrink_200_200/0?e=1589414400&v=beta&t=Byb1TpW6HtbGDebUzCOxJcAu13DCfkg38EobyT8_Fhw,"As a marketing veteran, Belle’s international working experiences enabled her to understand profoundly and communicate efficiently between China and the rest of the world."
101,Ariel,Tsai,,https://www.linkedin.com/in/ariel-yi-chen-tsai-037922146/,PingPong Digital,United Kingdom,Europe,,,"An experienced Business Developement Manager at PingPong Digital. PingPong Digital is the award winning Chinese marketing agency based in the UK, US and China. We are the partner agency with WeChat, Weibo, Douyin and TouTiao."
102,Jiao ,Li,,https://www.linkedin.com/in/jiao-li-crayfish/,Crayfish.io,United Kingdom,Europe,,,"I am the Co-Founder of Crayfish.io, the leading multi-platform service provider offering expertise, connections and capital to enable businesses to achieve better engagement with China. Having studied for a Finance degree at Nankai University, I completed my MA (Operational Research) at London School of Economics before joining Unilever, where I spent six years working as E-Commerce and Digital Manager, leading cross-functional teams in the UK and China. I am a highly experienced ecommerce and digital marketing specialist, passionate about helping brands reach out and interact with Chinese audiences in a smarter and more engaging way."
103,Evelyn,Engesser,PR,https://www.linkedin.com/in/evelynengesser/,UNICEPTA Information Consulting,Greater China,Greater China,,https://media-exp1.licdn.com/dms/image/C4E03AQHcg7PqNU4RXA/profile-displayphoto-shrink_200_200/0?e=1589414400&v=beta&t=jj2agpVS4N9i0Os9zPTWIWUzMoKh3SA-FLFpS_hMFKo,"Evelyn is a communications expert with 25 years of experience in the field of media analysis, market research and strategic consulting services. With her wide experience in academia and industry, Evelyn helps clients from big and small companies to measure the success of marketing, PR and Corporate Communication activities. She is General Manager of UNICEPTA’s office in Shanghai, where she built up a high performing multicultural team and network that covers the Asian-Pacific market."
104,Rong,Wang,,https://www.linkedin.com/in/rong-wang-42b94763/,UNICEPTA Information Consulting,Greater China,Greater China,,https://media-exp1.licdn.com/dms/image/C4D03AQGyrMYZKKjXqQ/profile-displayphoto-shrink_200_200/0?e=1589414400&v=beta&t=w095fZoA6r-dSS6SEdI4JxQJr8e2wJgGUIdeyNOgBEk,"Experienced Vice General Manager with a demonstrated history of working in the public relations and communications industry. Skilled in Media Relations, Corporate Communications, Market Research, Management, and Marketing. Strong operations professional graduated from Ruprecht-Karls-Universität Heidelberg."
105,Yingying ,Li,Branding,https://www.linkedin.com/in/liyingying727/,"Yingfluence, Inc.",USA,North America,,https://media-exp1.licdn.com/dms/image/C5603AQFpkDI7oAYdVw/profile-displayphoto-shrink_200_200/0?e=1589414400&v=beta&t=VIYOUjKwi1mJic3kn3_MAg_yb8CIdKwi4UywAwZK28s,"Founder of Yingfluence, Inc. & Co-Host of the ""How China Works"" podcast. 10+ Years of operation and business development in the U.S., China, Brazil, India, and Turkey. AACYF ""30 under 30” Chinese entrepreneur in the U.S. Founder of Yingfluence, Inc. a Silicon Valley-based startup which empowers professionals to connect and lead their brands cross-culturally. Clients include Forbes billionaires and executives from Facebook, LinkedIn, Cisco and Intel. Yingying also serves as a mentor at Founders Space, the No.1 Global Accelerator for Overseas Startups."
106,Laurence Lim,Dally,Fashion & Luxury,https://www.linkedin.com/in/laurence-lim-dally/,Cherry Blossoms Marketing Research & Consulting,USA,North America,,https://media-exp1.licdn.com/dms/image/C4E03AQG2JW84tPNozA/profile-displayphoto-shrink_200_200/0?e=1589414400&v=beta&t=lEAZUDrU6ooNM1vDXg9AJfpmJt7eUuEg3FAUqtvtpeo,"Laurence is an expert about diversity and decoding cultural differences. After 5 years working for the French Government on diversity and equal opportunities issues, Laurence moved to Hong Kong in 2008 and founded Cherry Blossoms Market Research & Consulting, with the ambition to bridge the gap between East & West.
Cherry Blossoms is helping Western brands in beauty, hospitality, jewelry & watches, fashion, and wine & spirits to understand cultural differences between Asia and the West, so they can better resonate with Asian consumers.
Laurence is currently based out of New York City. She is a frequent keynote speaker on China and marketing Eg. China Connect, W.I.N forum, French Chamber of Commerce, Sotheby’s/Jingdaily, major international business schools."
107,Nora Yujing,Chen,Fashion & Luxury,https://www.linkedin.com/in/nora-yujing-chen-79745bb5/,,United Kingdom,Europe,,https://media-exp1.licdn.com/dms/image/C5603AQG9eXVyGfU1vA/profile-displayphoto-shrink_200_200/0?e=1589414400&v=beta&t=HjakMNUAXl10pHediObAllwUwEWCwQxo3KoFP-G0SMk,"PhD researcher at the University of Surrey, specializing in Digital marketing and sustainability marketing"
108,Tiantian,Gao,Social Media,https://www.linkedin.com/in/tiantian-gao-54185b136/,Next Ren Shanghai,Greater China,Greater China,,https://media-exp1.licdn.com/dms/image/C5103AQFXTce2YqH2dw/profile-displayphoto-shrink_200_200/0?e=1589414400&v=beta&t=wk2JsBo-Yw-AtUxK4c7DwwzrDeg46TUnbIQBNLonZbU,
109,Anita,Lee,Ecommerce,https://www.linkedin.com/in/anita-lee-citp-058abb22/,Digital Crew®,USA,North America,,https://media-exp1.licdn.com/dms/image/C4D03AQGJf4604KkP6A/profile-displayphoto-shrink_200_200/0?e=1589414400&v=beta&t=GujbLed2QqtGI94H5zyXMobVI0SGV_3naldn83RXz2Y,"Cross border business, retail, e-commerce entrepreneurial deal closer and bilingual with diverse experience focusing in branding strategy, profitability maximization and sourcing. Use strong analytical skills to hunt new and missed opportunities. A frequent traveller (up to 90%) in North America, Mainland China, Hong Kong, Taiwan and Macau."
110,Émilie,Arrouf,,https://www.linkedin.com/in/emiliearrouf/,Danone,Greater China,Greater China,,https://media-exp1.licdn.com/dms/image/C4E03AQH2ffTmZV-9gg/profile-displayphoto-shrink_200_200/0?e=1589414400&v=beta&t=dbu51mdb7U5Y_JMGDkNJATC_yZT5ujFKlDEiLhIcDr0,"French native with an experience of +8years in China, servicing world leading brands to optimise their business strategy on this complex market.  Expert in Brand management, managed broad Marketing strategy."
111,Dragon,Zhang,,https://www.linkedin.com/in/dragonaiesec/?originalSubdomain=cn,TOMORROW,Greater China,Greater China,,https://media-exp1.licdn.com/dms/image/C5103AQHjuumruapkOA/profile-displayphoto-shrink_200_200/0?e=1589414400&v=beta&t=qilUnN5P33sXh_26-zsnhOmufND9JHoJySc8t_gGe2Y,"Greater China Young Achiever of 2019, Strategy Head at TOMORROW. Presidented over the branding, communication and digital strategy across all of TOMORROW’s 34 brands, accounting for 96% of the annual revenue."
112,Sofi Firyuza,Alibek,Social Media,https://www.linkedin.com/in/sofi-alibek-b7a448141/,GMA,Greater China,Greater China,,https://media-exp1.licdn.com/dms/image/C5103AQGDXqAlSRNaeg/profile-displayphoto-shrink_200_200/0?e=1589414400&v=beta&t=WVdwLYQziqUfJ9mB4smftXyrplxE-AkCH-RrdXlHlJA,"Sofi Firyuza is an expert on Branding, Lead Generation and Social Media Marketing in China. Sofi Firyuza helps businesses to enter Chinese Market, establish branding and strategize digital marketing performance. Helping foreign brands to increase awareness, sales, and maximize ROI in both B2B and B2C companies. Her expertise is in developing and outlining effective digital marketing and business strategies that deliver results, drive revenue, build healthy companies and yield positive ROI."
113,Ophenia ,Liang,,https://www.linkedin.com/in/ophenialiang/,Digital Crew®,Australia,Australia & New Zealand,,https://media-exp1.licdn.com/dms/image/C5103AQHo6o41SZoraA/profile-displayphoto-shrink_200_200/0?e=1589414400&v=beta&t=MbF_7vH5tIgxxfQp0fFmjgFGzSFVttcuObTLm6luyiI,"Liang is a specialist digital marketer into China with both academic and practical experience across the APAC region. She has assisted key global brands to enter and grow in the Chinese market through her strategic planning, execution and evaluation. She is also a highly sought-after speaker, as a result of her knowledge and digital marketing expertise selling into Asian markets, particularly China. Liang’s area of expertise covers Chinese marketing, team management, account management, strategic planning, international media planning, PPC (GAP Qualified), Baidu SEM (Senior consultant), SEO, social media and web analytics. Winner of Young Entrepreneur Award"
114,Sheryl ,Shen,,https://www.linkedin.com/in/sheryl-shen-398149b6/,China Skinny,Greater China,Greater China,,https://media-exp1.licdn.com/dms/image/C4D03AQEpxvsWbxcS8g/profile-displayphoto-shrink_200_200/0?e=1589414400&v=beta&t=fADNhs9pgPvTZmTiqcXH9BmadUOPSoJyJXdafqsk8NU,China market insight expert for MNCs. An empathetic specialist with significant experience with the coordination of traditional Chinese and Western teams in market intelligence sectors; who understands the importance of cultural differences and communication.
115,April,Li,Social Media,https://www.linkedin.com/in/aprillihanyu/,Visionarists,USA,North America,,https://media-exp1.licdn.com/dms/image/C5603AQEgij0zX35OxQ/profile-displayphoto-shrink_200_200/0?e=1589414400&v=beta&t=8xCywIFKM1a6hSz-wRA5UghpFdigewN3ZmXfCJXDFOY,"Graduated with a Masters degree in Social Media & Mobile Marketing, I am a strategy lead for both digital and content marketing. I focused on the client’s needs and delivered successful results for clients such as Christofle, Inter Milan, Community Healthcare Network, Shiseido, Gerber, Mass Mutual, etc. Specialized in influencer & content marketing, social media & digital strategy, I am passionate about being a storyteller and deliver the best creative and strategic solutions for my clients, and connect them with the most effective resource and partnerships. CORE COMPETENCES:
Global Content Strategy
Influencer Marketing
Project Management
Branding & Creative Solutions
Market Research and Consumer Insights
Go-to-Market Strategy
Contracts and Negotiation
Key Account/Talent Management
"
116,Nishtha,Mehta,,https://www.linkedin.com/in/nishthamehta/,CollabCentral,Greater China,Greater China,,https://media-exp1.licdn.com/dms/image/C4D03AQEsaoggc4zcgg/profile-displayphoto-shrink_200_200/0?e=1589414400&v=beta&t=m-NLDnQqD9CMazJRTPHDWDgbgHc_HS1ihoFBsuIjPko,"As a Corporate lean innovation coach, trainer and executive leadership facilitator with China, India and Asia experience of over 17 years, Nishtha designs, facilitates & delivers collaborative leadership & digital transformation acceleration with the purpose to infuse open innovation, starting-up, co-creation & intrapreneur culture. Client partners have ranged from the Fortune 500 in various industries– Beauty, Sports, Lifestyle, F&B, FMCG, Mother & Child, Health Tech, IoT, New Retail. Likes of: Unilever, Starbucks, L’Oreal, Reckitt Benckiser, Bosch, Philips, Hansgrohe, Wyeth Nutriton, adidas, British Petroleum, Cadbury Schweppes (now Mondelez), Allergan (Pharma/Cosmetic beauty)et al"
117,Claudia,Verbost,Ecommerce,https://www.linkedin.com/in/claudiaverbost/,Agency China,Netherlands,Europe,,https://media-exp1.licdn.com/dms/image/C5603AQH4x9wungFBfw/profile-displayphoto-shrink_200_200/0?e=1589414400&v=beta&t=eFt6pvcNaDmAbZvjxd-0vPKnTv_ppkZqNdi4NxMYbfA,"Selfmade China Marketing Professional, with 5+ years of working experience in the Chinese sales and marketing industry. Skilled in Chinese Marketing Channels, Project Management, and Sales Management. "
118,Nadezhda ,Bukina,Beauty,https://www.linkedin.com/in/nadezhda-bukina/,Self Employed,Greater China,Greater China,,https://media-exp1.licdn.com/dms/image/C5103AQGDQAtKFB5lug/profile-displayphoto-shrink_200_200/0?e=1589414400&v=beta&t=jIMihMPaN5stdO3PJ0FYTYR9hlyweBVUWMdd5mKypn8,"I find inspiration in people, who have the courage to create, invent and bring their contribution to the world. Through my experience in China, I have met numbers of inspiring entrepreneurs, and it was my pleasure to polish their ideas, audit their performance and social networks and give an overall fresh-eye look. My experience in a multinational company greatly developed my managing and marketing skills, and my school gifted me a truly cosmopolitan view on the world."
119,Kate,Sogor,Food & Beverage,https://www.linkedin.com/in/katalin-s%C3%B3gor-619a6286/,MAX SPORT ltd.,Greater China,Greater China,,https://media-exp1.licdn.com/dms/image/C4E03AQGXqovZlsXBdg/profile-displayphoto-shrink_200_200/0?e=1589414400&v=beta&t=-tQHMnWeWrFXt0SZt_VgzmRMfp0tfm4Gn1i74M8_D4o,"Kate is dynamic and driven professional working with businesses that want to enter, grow and succeed in the Chinese market, by providing the latest and hands-on China marketing management and strategies. Main experience is in B2C and B2B marketplaces"
120,Anita ,Leonelli,Branding,https://www.linkedin.com/in/anitaleonelli/,MADJOR,Greater China,Greater China,,https://media-exp1.licdn.com/dms/image/C5103AQF_GCtpS-vdoQ/profile-displayphoto-shrink_200_200/0?e=1589414400&v=beta&t=LidDbeTdE4fZaecdC54UaTC87DfgN5xpvjGBuL7Bnbk,Main focus areas are branding and experience design.
121,Eva,Hsu,,https://www.linkedin.com/in/evataipei101/,Ripplr,Greater China,Greater China,,https://media-exp1.licdn.com/dms/image/C5103AQH0kH9xAlzfrw/profile-displayphoto-shrink_200_200/0?e=1589414400&v=beta&t=FFQzl4q5j1JGVOJ7ybYMxggTNpWOJwmPV73745_1mmw,"As the founder of Ripplr, I help brands create ripple effects on social media, leveraging different networks, through creative storytelling to engage and empower communities and their customers. What we do in a nutshell: Storytelling your brand, empowering your customers."
122,Lulu,Zhang,Social Media,https://www.linkedin.com/in/lulu-zhang-5b25b920/?trk=profile_share_wechat&from=singlemessage&isappinstalled=0,Weibo,Greater China,Greater China,,https://media-exp1.licdn.com/dms/image/C5603AQGswJ_9B8DsoQ/profile-displayphoto-shrink_200_200/0?e=1589414400&v=beta&t=QkxwiWlio7Wbr3yj0cBK2bRo0Jez0Da2uIeDXHHLaoc,"Since joining Sina in 2013, Lulu has been deeply involved in the industry and witnessed the evolution of travel organization content on Weibo. During her tenure, Lulu has mainly worked with tourism organizations and media, and reported travel news. With rich industry resources, she has participated in international tourism conferences and interviewed domestic and international celebrities and senior officials of tourism bureaus. She has also planned and assisted social marketing campaigns for tourism bureaus. Organized the first China-USA Travel Influencer Summit in Los Angeles. Lulu Zhang works at Sina headquarter in Beijing. She graduated from The University of Nottingham UK with MSc Tourism Management and Marketing."
123,Chrissie,Chan,PR,https://www.linkedin.com/in/chrissie-chan-90405017a/,Clicks Marketing Solutions,Greater China,Greater China,,https://media-exp1.licdn.com/dms/image/C5103AQGcwaM9LjgLOQ/profile-displayphoto-shrink_200_200/0?e=1589414400&v=beta&t=X78X4u3NUgCTRm0pHBVLtY-NwjstuYx1hzQMeg-CMpY,Creative Marketing Consultant
124,Oceanne,Zhang,Ecommerce,https://www.linkedin.com/in/oceanne-zhang-7534014a/,Kantar,Greater China,Greater China,,https://media-exp1.licdn.com/dms/image/C5603AQF-FDWuus-kSA/profile-displayphoto-shrink_200_200/0?e=1589414400&v=beta&t=0w9NSgLYxgkJTX7q_aE4c8la2DGnT6e2c4l64XEjElk,Lead eCommerce & Digital offer in Kantar Retail China
125,Charlene,Liu,,https://www.linkedin.com/in/liucharlene/,Ladies Who Tech,Greater China,Greater China,,https://media-exp1.licdn.com/dms/image/C5103AQG6bjKi5IJohQ/profile-displayphoto-shrink_200_200/0?e=1589414400&v=beta&t=LXbaJsolKYvF9_UYESB7tsXOH91582Gux4OR_S6qsWk,"Charlene is an engineer, a social change maker, and a community builder. She is presently busy with building her Ladies Who Tech empire, Diversity & Inclusion (D&I) advocacy, volunteering for ShanghaiPRIDE, and events management. She has 20 years of working experience in Semiconductor & Electronics ranging from design, engineering, manufacturing, project management to sales and marketing in China, Singapore, and Malaysia; and 14 years of community leadership and event management experience. She was a management consultant at PwC before embarking full time on her entrepreneurial journey. "
126,Ge,Hu,,https://www.linkedin.com/in/ge-hu-80809b2b/,Kantar,Greater China,Greater China,,https://media-exp1.licdn.com/dms/image/C5103AQEKoDn4hwm2JA/profile-displayphoto-shrink_200_200/0?e=1589414400&v=beta&t=RaACPXX_OpJK_DhkxKn1OpV7Ip61LDNsKjf9tQC8RMw,
127,Ye,Han,,https://www.linkedin.com/in/ye-han-7b44157/,Kantar,Greater China,Greater China,,,
128,Julia,Xie,Ecommerce,https://www.linkedin.com/in/juliaxie/,Kantar,Greater China,Greater China,,https://media-exp1.licdn.com/dms/image/C5103AQGWL27cjFYOqw/profile-displayphoto-shrink_200_200/0?e=1589414400&v=beta&t=f4Famtep6nfx1AsPa_TmiTDgJ4T7B8xBLvBAZIyS2s8,"Experienced retail and shopper insights consultant and strategist with 20+ years proven track record to help market leaders across diversified retailing industry to explore growth opportunity through shopper-centric strategic planning and compelling retail activation in omnichannel context. 8-year client leadership role in the world’s leading research & insights company and 12-year functional head of consumer insights, strategy pricing, marketing communication and production in Fortune 500 companies. Passionate practitioner in burning issue solving, innovation, analytical thinking, cross-boundary collaboration and connecting the dots. Self-motivated with strong entrepreneurship spirit and leadership skills to drive commercial growth and talent flourishment ."
129,Léa,Pellequer,Fashion & Luxury,https://www.linkedin.com/in/leapellequer/,OnTheList,Greater China,Greater China,,https://media-exp1.licdn.com/dms/image/C5603AQHRFJ1J30hs_w/profile-displayphoto-shrink_200_200/0?e=1589414400&v=beta&t=UUqNKLelA6psYdOvEGQDmGBKpQvTK6uoUkhzY9Snt5E,"I am a marketing addict with an entrepreneur spirit. Over the past 6 years I worked in cosmetics and fashion industries in which I used my marketing insights and management skills to implement changes and improve profitability. Specifically, I have developed the marketing strategy and business model of Atelier Fusari, a tailor-made suit brand based in Shanghai, with a high brand awareness on the Chinese market and a steady growth since 2014. "
130,Elsie,Zhang,Fashion & Luxury,https://www.linkedin.com/in/elsiezhang/,Digital Luxury Group (DLG),Greater China,Greater China,,https://media-exp1.licdn.com/dms/image/C5603AQEXlhvDR_kF9g/profile-displayphoto-shrink_200_200/0?e=1589414400&v=beta&t=t-B36VueA2EMhZMWclNWjsWQO409KJEKqFRT2Rz8jzk,"Elsie has eight years of experience in fashion and merchandising, and another four in digital marketing for international luxury brands in China. Her expertise includes luxury digital communications strategy, creative campaign activation, e-commerce."
